{"version":2,"run_id":"simple-nas-20260628-2329-3eca32","workflow_name":"simple-nas","status":"running","created_at":"2026-06-28T15:29:34.684582+00:00","last_seq":543,"dag":{"nodes":["reporter","setup","baseline","selector","mutator_hyperparam","mutator_sota","mutator_structural","analyzer"],"edges":[["setup","baseline"],["baseline","selector"],["selector","mutator_structural"],["selector","mutator_hyperparam"],["selector","mutator_sota"],["mutator_structural","analyzer"],["mutator_hyperparam","analyzer"],["mutator_sota","analyzer"]],"conditional_edges":[{"from":"analyzer","to":"reporter","label":"pass"},{"from":"analyzer","to":"selector","label":"fail"}]},"latest_iter_by_node":{"setup":1},"current_iter":1,"iter_index":{"setup":[{"iter":1,"status":"completed","duration_ms":208084,"summary":"Setup complete for Deep-JSCC-PyTorch NAS project:\n- Entry: _nas_entry.py (copied from template, supporting --model-path …"}]},"fitness_history":[],"charts":null}